Title,URL
Close up of a diagonal DNA Chain of water. 3D rendering,https://us.123rf.com/450wm/polesnoy/polesnoy1708/polesnoy170800119/84913114-close-up-of-a-diagonal-dna-chain-of-water-3d-rendering.jpg
DNA molecules design with female hand holding pincers. Mixed media,https://us.123rf.com/450wm/nexusplexus/nexusplexus1906/nexusplexus190600565/124681635-dna-molecules-design-with-female-hand-holding-pincers-mixed-media.jpg
Medicine doctor touching electronic medical record on tablet.,https://us.123rf.com/450wm/ipopba/ipopba1908/ipopba190800080/128384883-medicine-doctor-touching-electronic-medical-record-on-tablet-.jpg
Abstract science background with DNA strands,https://us.123rf.com/450wm/zven0/zven01605/zven0160500020/58118002-abstract-science-background-with-dna-strands.jpg
Businessman on blurred background using digital network connection sphere 3D rendering,https://us.123rf.com/450wm/sdecoret/sdecoret1801/sdecoret180100697/93261200-businessman-on-blurred-background-using-digital-network-connection-sphere-3d-rendering.jpg
3D render of a medical background with DNA strands,https://us.123rf.com/450wm/kjpargeter/kjpargeter1605/kjpargeter160500118/59040931-3d-render-of-a-medical-background-with-dna-strands.jpg
"Science template, wallpaper or banner with a DNA molecules. Vector illustration.",https://us.123rf.com/450wm/krulua/krulua1601/krulua160100111/51427477-science-template-wallpaper-or-banner-with-a-dna-molecules-vector-illustration-.jpg
Abstract science background with DNA strands,https://us.123rf.com/450wm/zven0/zven01603/zven0160300009/54795583-abstract-science-background-with-dna-strands.jpg
"science, chemistry, biology, medicine and people concept - close up of scientist hand with test sample making research in clinical laboratory over hydrogen chemical formula and dna molecule structure",https://us.123rf.com/450wm/dolgachov/dolgachov1603/dolgachov160302408/53495784-science-chemistry-biology-medicine-and-people-concept-close-up-of-scientist-hand-with-test-sample-ma.jpg
DNA chain over abstract blue background. Vector illustration.,https://us.123rf.com/450wm/kotkoa/kotkoa1411/kotkoa141100041/33284248-dna-chain-over-abstract-blue-background-vector-illustration-.jpg
Abstract science background with DNA strands,https://us.123rf.com/450wm/zven0/zven01603/zven0160300005/54795567-abstract-science-background-with-dna-strands.jpg
"close up view of a dna double helix, dna damage, concept of disorder or genetic mutation (3d render)",https://us.123rf.com/450wm/lucadp/lucadp1903/lucadp190300033/125130354-close-up-view-of-a-dna-double-helix-dna-damage-concept-of-disorder-or-genetic-mutation-3d-render-.jpg
3D illustration. Genetic code DNA coming out of the fingerprint.,https://us.123rf.com/450wm/ktsdesign/ktsdesign1712/ktsdesign171200001/91098166-3d-illustration-genetic-code-dna-coming-out-of-the-fingerprint-.jpg
Medical capsule with a DNA molecule structure inside isolated on white background,https://us.123rf.com/450wm/ravital/ravital1512/ravital151200034/50261297-medical-capsule-with-a-dna-molecule-structure-inside-isolated-on-white-background.jpg
"science, chemistry, biology and people concept - close up of scientist hand with microscope and green leaf making research in laboratory over hydrogen chemical formula and dna molecule structure",https://us.123rf.com/450wm/dolgachov/dolgachov1603/dolgachov160303330/53627992-science-chemistry-biology-and-people-concept-close-up-of-scientist-hand-with-microscope-and-green-le.jpg
Abstract science background with DNA strands,https://us.123rf.com/450wm/zven0/zven01603/zven0160300003/54795565-abstract-science-background-with-dna-strands.jpg
DNA background,https://us.123rf.com/450wm/ssilver/ssilver1407/ssilver140700014/29819739-dna-background.jpg
"science, chemistry, technology, biology and people concept - close up of female scientist looking to microscope in clinical laboratory over hydrogen chemical formula and dna molecule structure",https://us.123rf.com/450wm/dolgachov/dolgachov1601/dolgachov160104232/51129858-science-chemistry-technology-biology-and-people-concept-close-up-of-female-scientist-looking-to-micr.jpg
Grey DNA with polygon line on black abstract background. Polygonal space low poly with connecting dots and lines. Connection structure. Vector science background.,https://us.123rf.com/450wm/tohey/tohey1612/tohey161200061/69152377-grey-dna-with-polygon-line-on-black-abstract-background-polygonal-space-low-poly-with-connecting-dot.jpg
Plants background with biochemistry structure.,https://us.123rf.com/450wm/marchuto/marchuto1905/marchuto190500020/134281842-plants-background-with-biochemistry-structure-.jpg
3D illustration of a method of DNA sequencing.,https://us.123rf.com/450wm/ktsdesign/ktsdesign1606/ktsdesign160600002/59787581-3d-illustration-of-a-method-of-dna-sequencing-.jpg
"Science template, wallpaper or banner with a DNA molecules.",https://us.123rf.com/450wm/krulua/krulua1601/krulua160100109/51422590-science-template-wallpaper-or-banner-with-a-dna-molecules-.jpg
"Genetic science symbols in DNA shape icon. Vector element with scientific and medical objects formula, microscope, atom, chemicals, dna structure, book, molecule, water, rocket, telescope",https://us.123rf.com/450wm/seamartini/seamartini1610/seamartini161000705/64878109-genetic-science-symbols-in-dna-shape-icon-vector-element-with-scientific-and-medical-objects-formula.jpg
Telomeres length loss with DNA and shortening telomere medical concept as a tree with falling leaves on the end caps of a chromosome as a symbol for aging and living a shorter life due to genetic age damage with 3D illustration elements.,https://us.123rf.com/450wm/lightwise/lightwise1704/lightwise170400018/75432646-telomeres-length-loss-with-dna-and-shortening-telomere-medical-concept-as-a-tree-with-falling-leaves.jpg
DNA molecules design with female hand holding pincers. Mixed media,https://us.123rf.com/450wm/nexusplexus/nexusplexus1905/nexusplexus190500583/123587213-dna-molecules-design-with-female-hand-holding-pincers-mixed-media.jpg
Rear View Of A Male Doctor Taking A Bodily Fluid Sample For DNA Test,https://us.123rf.com/450wm/andreypopov/andreypopov1909/andreypopov190900639/130273529-rear-view-of-a-male-doctor-taking-a-bodily-fluid-sample-for-dna-test.jpg
"DNA molecule sign set, genetic elements and icons collection strand. Vector eps10",https://us.123rf.com/450wm/whilerests/whilerests1610/whilerests161000089/66867135-dna-molecule-sign-set-genetic-elements-and-icons-collection-strand-vector-eps10.jpg
scientist holding tube and working with laptop in genetics lab / engineer genetic working in laboratory,https://us.123rf.com/450wm/angellodeco/angellodeco1606/angellodeco160600019/59194947-scientist-holding-tube-and-working-with-laptop-in-genetics-lab-engineer-genetic-working-in-laborator.jpg
DNA background,https://us.123rf.com/450wm/ssilver/ssilver1404/ssilver140400050/27634727-dna-background.jpg
double helix structure on blue abstract background,https://us.123rf.com/450wm/vivilweb/vivilweb1411/vivilweb141100081/34032662-double-helix-structure-on-blue-abstract-background.jpg
Genetic fingerprinting as a fingerprint with DNA emerging out as a medical identification symbol for a paternity test or biotechnology genome icon.,https://us.123rf.com/450wm/lightwise/lightwise1601/lightwise160100030/50924189-genetic-fingerprinting-as-a-fingerprint-with-dna-emerging-out-as-a-medical-identification-symbol-for.jpg
golden DNA strands on abstract medical background,https://us.123rf.com/450wm/zven0/zven01111/zven0111100009/11142410-golden-dna-strands-on-abstract-medical-background.jpg
"Cell, Chromosome, DNA and gene. Cell Structure. The DNA molecule is a double helix. A gene is a length of DNA that codes for a specific protein. Genome Study",https://us.123rf.com/450wm/designua/designua1601/designua160100028/52129452-cell-chromosome-dna-and-gene-cell-structure-the-dna-molecule-is-a-double-helix-a-gene-is-a-length-of.jpg
Dna structure converted into binary code. Digital illustration.,https://us.123rf.com/450wm/andreus/andreus1512/andreus151200039/50824627-dna-structure-converted-into-binary-code-digital-illustration-.jpg
Purple background with DNA. Scince illustration of a DNA molecule.,https://us.123rf.com/450wm/kotkoa/kotkoa1604/kotkoa160400027/56485856-purple-background-with-dna-scince-illustration-of-a-dna-molecule-.jpg
Scince illustration of a DNA molecule. Vector illustration.,https://us.123rf.com/450wm/kotkoa/kotkoa1601/kotkoa160100140/51375169-scince-illustration-of-a-dna-molecule-vector-illustration-.jpg
DNA helix pattern set,https://us.123rf.com/450wm/robuart/robuart1802/robuart180201050/96368801-dna-helix-pattern-set.jpg
Dna Tree Logo Icon Design,https://us.123rf.com/450wm/putracetol/putracetol1805/putracetol180508214/102231074-dna-tree-logo-icon-design.jpg
"DNA Plant Double Helix Concept, can refer to alternative medicine, crop gene modification or other healthcare or medical theme.",https://us.123rf.com/450wm/krisdog/krisdog1608/krisdog160800033/61100298-dna-plant-double-helix-concept-can-refer-to-alternative-medicine-crop-gene-modification-or-other-hea.jpg
Cells under microscope,https://us.123rf.com/450wm/olegdudko/olegdudko1905/olegdudko190500030/123948376-cells-under-microscope.jpg
3d dna in color background,https://us.123rf.com/450wm/rbhavana/rbhavana1009/rbhavana100900256/7858918-3d-dna-in-color-background.jpg
Blue background with DNA. Blue background and abstract molecular connection with DNA molucule. Vector illustration.,https://us.123rf.com/450wm/kotkoa/kotkoa1601/kotkoa160100095/50920125-blue-background-with-dna-blue-background-and-abstract-molecular-connection-with-dna-molucule-vector-.jpg
Biochemistry science concept with DNA molecule on blue background,https://us.123rf.com/450wm/nexusplexus/nexusplexus1602/nexusplexus160200001/51505925-biochemistry-science-concept-with-dna-molecule-on-blue-background.jpg
DNA golden structure model with soft focus. Science medical research concept. 3d rendering,https://us.123rf.com/450wm/deniskot/deniskot1604/deniskot160400005/57536240-dna-golden-structure-model-with-soft-focus-science-medical-research-concept-3d-rendering.jpg
molecule dna cell illustration,https://us.123rf.com/450wm/itorn/itorn1311/itorn131100044/23764337-molecule-dna-cell-illustration.jpg
Genetic engineering and gene manipulation concept. Hand is replacing part of a DNA molecule.,https://us.123rf.com/450wm/vchalup/vchalup1703/vchalup170300239/76216227-genetic-engineering-and-gene-manipulation-concept-hand-is-replacing-part-of-a-dna-molecule-.jpg
Illustration art of a Eco DNA icon with isolated background,https://us.123rf.com/450wm/magadesigns/magadesigns1609/magadesigns160900022/63156838-illustration-art-of-a-eco-dna-icon-with-isolated-background.jpg
Supreme collagen oil drop essence with DNA helix. Premium shining serum droplet. Vector illustration.,https://us.123rf.com/450wm/rondale/rondale1604/rondale160400019/54612168-supreme-collagen-oil-drop-essence-with-dna-helix-premium-shining-serum-droplet-vector-illustration-.jpg
Dna spiral. 3d illustration isolated on white background,https://us.123rf.com/450wm/montego/montego1604/montego160400037/58085229-dna-spiral-3d-illustration-isolated-on-white-background.jpg
Blue background with DNA.,https://us.123rf.com/450wm/kotkoa/kotkoa1601/kotkoa160100127/51374966-blue-background-with-dna-.jpg
dna and medical and technology background. futuristic molecule structure presentation. for business solution,https://us.123rf.com/450wm/vska/vska1608/vska160800174/61547674-dna-and-medical-and-technology-background-futuristic-molecule-structure-presentation-for-business-so.jpg
High technology DNA molecule background as biochemistry science concept,https://us.123rf.com/450wm/nexusplexus/nexusplexus1602/nexusplexus160203267/51848170-high-technology-dna-molecule-background-as-biochemistry-science-concept.jpg
DNA Abstract icon and element collection. Futuristic technology interface. Vector format,https://us.123rf.com/450wm/vska/vska1601/vska160100047/50385972-dna-abstract-icon-and-element-collection-futuristic-technology-interface-vector-format.jpg
"Artificial DNA molecule, the concept of artificial intelligence, on a white background",https://us.123rf.com/450wm/iaremenko/iaremenko1601/iaremenko160100101/51350973-artificial-dna-molecule-the-concept-of-artificial-intelligence-on-a-white-background.jpg
3D medical background with DNA strands,https://us.123rf.com/450wm/kjpargeter/kjpargeter1603/kjpargeter160300117/53848309-3d-medical-background-with-dna-strands.jpg
"Illustration Abstract Molecules and Mesh lines, Circles, Polygon shapes. Vector design communication technology on blue background. Futuristic- digital technology concept.",https://us.123rf.com/450wm/number168/number1681608/number168160800058/62223449-illustration-abstract-molecules-and-mesh-lines-circles-polygon-shapes-vector-design-communication-te.jpg
"Unrecognizable woman with blond hair holding blue dna helix hologram. Biotech, biology, medicine and science concept. Double exposure toned image",https://us.123rf.com/450wm/ismagilov/ismagilov1809/ismagilov180900995/108521459-unrecognizable-woman-with-blond-hair-holding-blue-dna-helix-hologram-biotech-biology-medicine-and-sc.jpg
Science background with DNA molecules from water on white. 3D rendering,https://us.123rf.com/450wm/irochka/irochka1802/irochka180200082/94988566-science-background-with-dna-molecules-from-water-on-white-3d-rendering.jpg
Portrait of sensual woman among DNA chains,https://us.123rf.com/450wm/hedgehog/hedgehog1801/hedgehog180100016/92860465-portrait-of-sensual-woman-among-dna-chains.jpg
Biotechnology background concept,https://us.123rf.com/450wm/nexusplexus/nexusplexus1810/nexusplexus181000983/110613229-biotechnology-background-concept.jpg
Businesswoman on blurred background using digital network connection sphere 3D rendering,https://us.123rf.com/450wm/sdecoret/sdecoret1801/sdecoret180101026/93263252-businesswoman-on-blurred-background-using-digital-network-connection-sphere-3d-rendering.jpg
"Medicine doctor team meeting and analysis. Diagnose checking brain testing result with modern virtual screen interface on laptop with stethoscope in hand, Medical technology network connection concept.",https://us.123rf.com/450wm/ipopba/ipopba1805/ipopba180500049/102251803-medicine-doctor-team-meeting-and-analysis-diagnose-checking-brain-testing-result-with-modern-virtual.jpg
Dna helix vector background. Genetic reseacrch process. Modified gene. Science biology dna technology background,https://us.123rf.com/450wm/amiavk/amiavk1804/amiavk180400013/98896519-dna-helix-vector-background-genetic-reseacrch-process-modified-gene-science-biology-dna-technology-b.jpg
Female doctor pointing at abstract DNA hologram on blurry background. Science concept,https://us.123rf.com/450wm/peshkov/peshkov1709/peshkov170900113/85037512-female-doctor-pointing-at-abstract-dna-hologram-on-blurry-background-science-concept.jpg
Vector abstract blue DNA double helix illustration with shallow depth of field. Mysterious source of life background. Genom futuristic image. Conceptual design of genetics information.,https://us.123rf.com/450wm/garrykillian/garrykillian1806/garrykillian180600112/104071890-vector-abstract-blue-dna-double-helix-illustration-with-shallow-depth-of-field-mysterious-source-of-.jpg
3D medical background with DNA strands and male head,https://us.123rf.com/450wm/kjpargeter/kjpargeter1603/kjpargeter160300132/53848324-3d-medical-background-with-dna-strands-and-male-head.jpg
dna and medical and technology background. futuristic molecule structure presentation. for business solution,https://us.123rf.com/450wm/vska/vska1608/vska160800179/61900328-dna-and-medical-and-technology-background-futuristic-molecule-structure-presentation-for-business-so.jpg
"3d rendering, DNA with blue background",https://us.123rf.com/450wm/fanjiann555/fanjiann5551902/fanjiann555190200020/117502379-3d-rendering-dna-with-blue-background.jpg
Molecular Structure Of DNA and RNA. Infographic Educational Vector Illustration,https://us.123rf.com/450wm/okamigo/okamigo1803/okamigo180300002/96730145-molecular-structure-of-dna-and-rna-infographic-educational-vector-illustration.jpg
Concept baby from a test tube. Shade from the kid in the form of a test tube.,https://us.123rf.com/450wm/adragan8/adragan81804/adragan8180400118/100467356-concept-baby-from-a-test-tube-shade-from-the-kid-in-the-form-of-a-test-tube-.jpg
"Close up a scientist working in laboratory to analyze blue extracted of DNA molecules in micro tube plate , clinical or science testing analysis concept",https://us.123rf.com/450wm/pinkomelet/pinkomelet1802/pinkomelet180200139/96684337-close-up-a-scientist-working-in-laboratory-to-analyze-blue-extracted-of-dna-molecules-in-micro-tube-.jpg
Nutrigenetics concept illustration dna strand vegetables and fruits,https://us.123rf.com/450wm/aydinozon/aydinozon1901/aydinozon190100004/115248480-nutrigenetics-concept-illustration-dna-strand-vegetables-and-fruits.jpg
"Medicine doctor hand touching computer interface as medical network connection with modern virtual screen, medical technology network concept",https://us.123rf.com/450wm/ipopba/ipopba1710/ipopba171000022/87841208-medicine-doctor-hand-touching-computer-interface-as-medical-network-connection-with-modern-virtual-s.jpg
Background on medical subjects with spiral DNA. Popular science background,https://us.123rf.com/450wm/starlena/starlena1709/starlena170900017/86097398-background-on-medical-subjects-with-spiral-dna-popular-science-background.jpg
DNA molecule structure on red texture background. Biochemistry concept,https://us.123rf.com/450wm/vladimircaribb/vladimircaribb1904/vladimircaribb190400229/124446330-dna-molecule-structure-on-red-texture-background-biochemistry-concept.jpg
Portrait of sensual woman in DNA chains.,https://us.123rf.com/450wm/hedgehog/hedgehog1804/hedgehog180400504/99516536-portrait-of-sensual-woman-in-dna-chains-.jpg
DNA strand scientific vector background.,https://us.123rf.com/450wm/saibarilona/saibarilona1712/saibarilona171200025/91099893-dna-strand-scientific-vector-background-.jpg
"Abstract background technology concept in blue light,brain and human body heal ,technology modern medical science in future and global international medical with tests analysis clone DNA human",https://us.123rf.com/450wm/toodtuphoto/toodtuphoto1805/toodtuphoto180500026/100834169-abstract-background-technology-concept-in-blue-light-brain-and-human-body-heal-technology-modern-med.jpg
Dna on abstract background. 3d illustration,https://us.123rf.com/450wm/bluebay/bluebay1712/bluebay171200230/90941346-dna-on-abstract-background-3d-illustration.jpg
Dentist's Hand Taking Saliva Test From Woman's Mouth With Cotton Swab,https://us.123rf.com/450wm/andreypopov/andreypopov1904/andreypopov190400034/120157963-dentist-s-hand-taking-saliva-test-from-woman-s-mouth-with-cotton-swab.jpg
Digital DNA molecule structure. Concept binary code human genome. DNA molecule with modified genes. 3D illustration,https://us.123rf.com/450wm/rost9/rost91808/rost9180800127/106729011-digital-dna-molecule-structure-concept-binary-code-human-genome-dna-molecule-with-modified-genes-3d-.jpg
Destructing DNA molecule. Conceptual 3D,https://us.123rf.com/450wm/moovstock/moovstock1912/moovstock191200755/134873451-destructing-dna-molecule-conceptual-3d.jpg
Gold DNA on Black Background,https://us.123rf.com/450wm/kotoffei/kotoffei1806/kotoffei180600006/102948795-gold-dna-on-black-background.jpg
3d illustration of molecule model. Science or medical background with molecules and atoms.,https://us.123rf.com/450wm/artemegorov/artemegorov1710/artemegorov171000026/88710562-3d-illustration-of-molecule-model-science-or-medical-background-with-molecules-and-atoms-.jpg
3d illustration of molecule model. Science or medical background with molecules and atoms.,https://us.123rf.com/450wm/artemegorov/artemegorov1710/artemegorov171000003/88611808-3d-illustration-of-molecule-model-science-or-medical-background-with-molecules-and-atoms-.jpg
Human brain IQ smart business concept. E-learning nootropic drug supplement DNA medicine neuroscience braingpower. Brainstorm creative idea project work low poly polygonal vector illustration,https://us.123rf.com/450wm/luckystep48/luckystep481805/luckystep48180500046/102364195-human-brain-iq-smart-business-concept-e-learning-nootropic-drug-supplement-dna-medicine-neuroscience.jpg
Night repair serum ads with neon helix background in 3d illustration,https://us.123rf.com/450wm/kchung/kchung1810/kchung181000220/110821540-night-repair-serum-ads-with-neon-helix-background-in-3d-illustration.jpg
"abstract technology science concept, DNA code structure with glow. Science concept background. Nano technology.",https://us.123rf.com/450wm/your123/your1231809/your123180900054/110518347-abstract-technology-science-concept-dna-code-structure-with-glow-science-concept-background-nano-tec.jpg
"Nucleus, Nucleolus, human body cell Nucleus of the eukaryotic cell In this figure it is visible the double membrane dotted ribosomes of the nuclear membrane, the DNA and the nucleolus Inside the core is present a viscous liquid called nucleoplasm",https://us.123rf.com/450wm/vampy1/vampy11310/vampy1131000471/23637898-nucleus-nucleolus-human-body-cell-nucleus-of-the-eukaryotic-cell-in-this-figure-it-is-visible-the-do.jpg
hands of scientist working with multichannel pipette and multi well plates / research technician with multipipette in genetic laboratory,https://us.123rf.com/450wm/olegdudko/olegdudko1905/olegdudko190500085/123948548-hands-of-scientist-working-with-multichannel-pipette-and-multi-well-plates-research-technician-with-.jpg
Abstract lines with lights,https://us.123rf.com/450wm/lassedesignen/lassedesignen1901/lassedesignen190100016/126282290-abstract-lines-with-lights.jpg
DNA molecules with female hand holding pincers. Mixed media,https://us.123rf.com/450wm/nexusplexus/nexusplexus1907/nexusplexus190700346/126216182-dna-molecules-with-female-hand-holding-pincers-mixed-media.jpg
Scientific concept. Laboratory worker holding test tube with liquid on color background,https://us.123rf.com/450wm/belchonock/belchonock1712/belchonock171203752/91440843-scientific-concept-laboratory-worker-holding-test-tube-with-liquid-on-color-background.jpg
"DNA Glittering Icon, Deoxyribonucleic Acid Chain",https://us.123rf.com/450wm/robuart/robuart1805/robuart180501672/101965424-dna-glittering-icon-deoxyribonucleic-acid-chain.jpg
DNA sequencing by the formula AGTC. modern medical background. vector illustration,https://us.123rf.com/450wm/pogorelovaolga/pogorelovaolga1806/pogorelovaolga180600084/104347060-dna-sequencing-by-the-formula-agtc-modern-medical-background-vector-illustration.jpg
"genetics line icons, dna chain, gene editing and genetic research, vector",https://us.123rf.com/450wm/nexusby/nexusby1911/nexusby191100100/133249484-genetics-line-icons-dna-chain-gene-editing-and-genetic-research-vector.jpg
"A telomere is a repeating sequence of double-stranded DNA located at the ends of chromosomes. Each time a cell divides, the telomeres become shorter. Cell Structure. The DNA molecule is a double helix. A gene is a length of DNA that codes for a specific protein. Genome Study. Cell, nucleus with chromosomes, telomeres, DNA, and gene",https://us.123rf.com/450wm/designua/designua1803/designua180300025/97574722-a-telomere-is-a-repeating-sequence-of-double-stranded-dna-located-at-the-ends-of-chromosomes-each-ti.jpg
Glowing digital DNA background. Medicine concept. 3D Rendering,https://us.123rf.com/450wm/peshkov/peshkov1708/peshkov170800235/83988481-glowing-digital-dna-background-medicine-concept-3d-rendering.jpg
Dna test infographic. Vector illustration. Genome sequence map. Template for your design.,https://us.123rf.com/450wm/olenayepifanova/olenayepifanova1906/olenayepifanova190600035/124719073-dna-test-infographic-vector-illustration-genome-sequence-map-template-for-your-design-.jpg
Science background with DNA molecules. 3D rendering,https://us.123rf.com/450wm/irochka/irochka1803/irochka180300504/98210109-science-background-with-dna-molecules-3d-rendering.jpg
